Unnamed: 0,text,Emotion
232,i can feel their joy and excitement for the opportunity to receive these vital ordinances,happiness
233,i worry about all of the time ive been spending on the computer and about how i feel so distracted by the party,worry
234,i feel like i cant be brave,neutral
235,i wish i could call off the wedding just so i can feel carefree again,neutral
236,i didnt feel scared at all,neutral
237,i feel really contented just listening to the song,happiness
238,i dont know who i like i feel so bitchy and flirty,neutral
239,ive had this urgent feeling to write to you and tell you how the files make me feel but have felt hesitant because of fear as to where it will lead me,neutral
240,i started to develop feelings for you they scared me and i freaked out but you promised me that i was safe,neutral
241,i guess avoiding the boundaries conversation with him has me feeling a little unsure about my confidence and strength,empty
242,im so damn tired and i feel a little grouchy,neutral
243,i was feeling quite something im not sure,neutral
244,i feel rude feel free to grab the seat next to me,neutral
245,im contemplating and feeling skeptical,neutral
246,i feel irritated useless and hopeless,neutral
247,i don t feel bothered about it getting credit equals getting debt and i have no interest in doing that again,neutral
248,i hurt your feelings or angered you with my last rant im sorry,neutral
249,i was feeling angry at myself for feeling self conscious about my shorts or for wishing that i wasnt alone,anger
250,i feel petty things but not to the extent that humans seem to feel them wars have been started over stupid little things and try as i might i cannot understand how things such as loving two people or feeling jealous can lead to murder and unhappiness,neutral
251,i was feeling pretty cranky this morning and stopping in here really made me feel a lot better,neutral
252,i was just yesterday feeling uncomfortable with highschool sigh,relief
253,i feel better now on the menu tonight,neutral
254,i feel so hesitant to say anything positive trying to hold my breath so to speak because none of this really matters until i know that shaun has passed the dlpt,neutral
255,i feel stressed out i would watch movies alone or just walk on the streets alone,neutral
256,i slough off the carapace of crud that has enveloped me for the past thirty odd hours i feel invigorated and finally ready to face the day,neutral
257,i discovered that it gave me a great feeling of satisfaction to produce a blog post a delicious dish a few photos a written recipe that tangible job completed feeling that s rare in my life as a stay at home mom,neutral
258,i feel a lot of pressure but i am determined to finish them so that i can visit my sister in may with a clear conscience,neutral
259,i feel myself getting agitated over something insignificant or feeling bored i m going to remember this quote,neutral
260,i feel bitchy i guess,neutral
261,i much regret that i allowed johann to accompany me from khartoum i feel convinced he can never rally from his present descara,neutral
262,i feel have been convinced by many factors in our culture of a kind of cooking mystique,neutral
263,im feeling very angry kind of sad tired and bored today,sadness
264,im feeling a much more festive with the tree in,neutral
265,i feel like as a creative professional you need to have that unpressed creative outlet to get re inspired,neutral
266,i feel very distressed because i m supportive of this campaign and with the senator jackson told cnn,neutral
267,i feel like i am being obnoxious by posting every three seconds,neutral
268,a girl entered in the division where i work and greeted everybody but not me,neutral
269,i started to feel apprehensive about it,neutral
270,i should not feel afraid we can stop shoulding all over ourselves,neutral
271,im feeling bitter towards them god,neutral
272,im being a teenager people and if you feel the need to make sarcastic bitchy comments you can kindly fuck off,neutral
273,i hate seeing those red windows even more as what i feel inside resonates with the cold uncaring world i know exists behind them making me even more aware of this pain inside of me,hate
274,i can understand feeling uncertain about the abc link,neutral
275,i came to china feeling a little frightened of everything around me,neutral
276,i tired of hearing of these unique communications special feelings and how sincere you are,neutral
277,i get the feeling that nellie is satisfied that the phone rang happy that leslie is out of the room now,happiness
278,i do feel weird why seldom people eat at there,neutral
279,i am not feeling fearful,neutral
280,i slow a bit to stay with him partly because i am feeling like if i start to win he will just give up and partly because i am afraid that if i push it he will kill himself trying to stay with me,neutral
281,i feel bitchy today its as if today i realized that i couldnt count on any of my friends anymore,neutral
282,i feel that the very foundations of my faith have been shaken to the core,neutral
283,i did feel that the ending was a bit rushed and i do wonder if i might have missed certain signs but its a small thing when the story happens to be addictive and you dont notice the time passing by,neutral
284,i did not feel like i was on the edge and it got to a point where i wasn t bothered about who wins and to hell with it whether this fight will even end,neutral
285,i feel crazily indecisive impulsive just in a,neutral
286,i feel overwhelmed when i think of a country suffering,neutral
287,i feel so heartless sometimes because i do not have the ability to mourn for the lost of someone relating to my past grandparents,neutral
288,i feel really free i feel that i can grow wings amp fly,neutral
289,i couldnt help feel infuriated when i had left the building,neutral
290,i just feel kind of heartless now,neutral
291,i feel stubborn and strong and ready to fight this disease,relief
292,i was also feeling really pleased that i decided well cajoled bullied and ordered to go out running this evening,relief
293,im not sure that feeling slightly wronged by the police the sheriff or the tsa is always a bad thing,neutral
294,i am feeling especially lively,neutral
295,i didn t need to mention our difference but i was feeling very vulnerable because of the differences and was having a bit of fear that in someway i am doing something wrong,neutral
296,im already feeling less agitated,neutral
297,i want to feel energetic again and when i do just that bit of exercise every day be it minutes i feel more awake energized and more focused,neutral
298,i feel like a greedy person for liking two people,neutral
299,i do feel offended and i think justly,neutral
300,im thinking that feeling extremely cold yesterday was more down to me brewing something than the actual weather,neutral
301,im most expressive when i feel distraught,neutral
302,i have a feeling that the smell is not going to be pleasant,neutral
303,i have control issues though they really only kick badly when i feel unprotected or dont trust my safety net,neutral
304,i cant let all these feeling in one blink im not a heartless person like you i give you a lot of change i give you a lot of change to come and change your decisions i give you a lot of change to find me but you threw it like a crap,neutral
305,i feel so despised and i feel this world is crumbling onto me again,neutral
306,i feel bore and restless,neutral
307,i don t feel frustrated anymore from the fierce us media campaign against egypt because the more they attack us the more we know that we are on the right track,neutral
308,i need to manage my spending money more wisely but im feeling uncertain and stressed as of late,neutral
309,as in sadness a,sadness
310,i feel so uncomfortable about the word hero,relief
311,i feel far too distracted to actually write anything of substance,neutral
312,i feel wonderful im tipping over backwards im so ambitious im looking back im running a race and youre the books i read so feel my fingers as they touch you arms im spinning around and i feel alright the book i read was in your eyes,neutral
313,i heard it somehow it brings me good feeling strange,neutral
314,i started explaining what my biggest problems were bottling up my feelings and then dumping all those problems onto one person and my selfish search for happiness when i had felt everyone around me had found their happiness,neutral
315,ive had a somewhat difficult time trying to find something to feel thankful for,neutral
316,i feel like people like this arent getting caught therefore the government plays it up when they catch criminals of petty crimes to make themselves look better,neutral
317,i call someone i feel like i need to at least talk a few minutes to not be rude,neutral
318,i think i m also feeling restless,neutral
319,i asked them to join me in creating a world where all year old girls could grow up feeling hopeful and powerful,neutral
320,i feel strange being thankful when such awful things on the other sides of the oceans that surround that country happen on a daily basis,neutral
321,i knew i needed to get over there but had been dragging my feet a combo of feeling intimidated by the language barrier and the kids nap schedules,neutral
322,im told by horsey people that they are a rare find so i feel quite lucky,neutral
323,i feel that as we study him we find that he was indeed a perfect example of what any christian and especially a latter day saint should be,neutral
324,i was feeling rebellious so i ate it,neutral
325,i feel uncertain about his motives and feel an inbalance in our committment to the process of counselling for reconciliation,neutral
326,i was still feeling weird about the day before,neutral
327,i feel like now i have the opportunity to become smart to embrace knowledge and really learn about everything i have daydreamed of learning,neutral
328,i feel useful again and serves as a reminder that ive come a long way since the first days of vertigo,neutral
329,i could feel the blood in my veins go cold,neutral
330,i started to feel super emotional all the time which was so strange,neutral
331,im feeling pretty rebellious right now because im writing this is my engineering class,neutral
332,i used to feel as if i would be hated and whatever so i kept quiet about god,hate
333,i feel my life being threatened by illness i lose my mind,neutral
334,i was really hoping that theyd get far enough ahead of us that we could feel like we were doing our own navigating so i was delighted when after punching the second control they headed off onto a trail through the woods,neutral
335,i feel so frustrated but i cant tell them i am,neutral
336,i wanted to say something to her but it was just a bad vibe and i was feeling hostile didnt think it was a good night to do so,neutral
337,i feel the eyes of many turn away disgusted by the self indulgence the audacity of a british woman to admit this point of failure,neutral
338,i feel incredibly charmed that i have these people in my life and that i am at such an exciting amazing chapter of things,neutral
339,i feel jealous of everyone who has the chance to meet you everyday,neutral
340,i brought up privately a couple weeks ago that i felt targeted after feeling frustrated and belittled,neutral
341,i feel honoured that my clients walk through my doors sometimes for the very first time and trust me with their brand new one week old bundles of joy,happiness
342,im sure its a great film but i guess i wasnt feeling too appreciative and just had a long day,neutral
343,i feel suspicious of innanimate objects and as though my house is actually the set of a play or a movie or some kind of model of itself and how did i come to be here and why is that carpet looking up at me like that,neutral
344,i feel hesitant to be putting the words on this page feeling like every time i hit a key i am tempting fate to take this away from me,neutral
345,i watched the snow fall and accumulate on the conifer trees while i was shoveling in my shirt sleeves and feeling vigorous,neutral
346,i feel that it could have been a more successful outcome had i explored new styles but kept it close to me and remained myself,neutral
347,i feel glad i can still teach him at home myself,neutral
348,im feeling overwhelmed i can just give people the middle finger or tell them to f off,neutral
349,ive had a feeling of being satisfied with the performance of my car,neutral
350,i tend to lose feel for the water pretty quickly when im not in the water every other day and i felt this during the race,neutral
351,my flatmate was asking questions about my relationship with my boyfriend,neutral
352,i feel honoured that she has chosen to share this with me,neutral
353,i feel tat all of us in this world are clever just depending on how u are born if u are born to be errrr not good but it will still would have some good things that u have it just that u dun realise it lol i noe its quite lame hope no one have read it img src http shared,neutral
354,i do have to wonder when you re cast as a caveman and you re told you re perfect for the part do you feel insulted or complimented,neutral
355,i feel highs so ecstatic that just being normal feels like a thousand mile drop and being unhappy is excruciating,happiness
356,i am feeling so festive right now and not just because this was the lovely wintry scene when i walked the dog the other day a href http,love
357,ive worked plenty of them and have yet to find one that leaves me feeling satisfied with the way ive spent another day that i will never get back,neutral
358,i don t know why i am feeling so sarcastic tonight but christian seems to enjoy my banter and every time seth apologizes for my behavior christian tells him it s quite alright and locks eyes with me,happiness
359,i find myself feeling agitated because of how what the kids are playing i ask myself did i play this way when i was little,neutral
360,im feeling so excited and eager,enthusiasm
361,i don t have any issues with the obvious i went chinese with them yesterday and i wasn t feeling hostile towards any of them,neutral
362,i find that i never stop feeling excited for our company s future,enthusiasm
363,i sat with dave atell at first trying not to feel rude while the guys were eating,neutral
364,im good at hiding my true feelings or blurting them out in sarcastic tones,neutral
365,ive been feeling really energetic at night and honestly i needed this,neutral
366,i can feel the beginnings of a cold so i figured i deserve a heinously hot bath,neutral
367,im inclined to believe that im simply too lazy to feel particularly greedy,neutral
368,i feel almost angry that i have been fed like a lab rat for so many years,anger
369,i couldnt feel thing however that kind of bothered me because i didnt feel it pop,neutral
370,i feel insecure all the time,neutral
371,i said feeling strange uttering those words but space flight was still a pretty novel way of traveling in my time,neutral
372,i actually feel insulted when the plot goes off on a tangent like that,neutral
373,i arrived at the gym she was such a ball of sunshine and made me feel very welcomed at the gym although i felt like a dorky unfit rotund sloth that did not fit in with the environment of buffed fit looking and fierce looking bloke,neutral
374,i can feel his impatient and i can t stop my body from giving him positive response,neutral
375,i have had a lot of uncaring men in my life and it still feels strange to have several that call come by and reach out to me when i am at my weakest moments,neutral
376,i don t i risk feeling vulnerable the feeling that everyone is staring at me and examining every little dimple in my thigh and sag in my arm,neutral
377,i also feel extremely blessed to be marrying into such a loving family,neutral
378,i am your friend then why do i sometime feel so insulted around you,neutral
379,ive also discovered that because i feel less agitated by caffeine and cravings this coping method is unnecessary huge,neutral
380,i don t discuss even my feelings for beloved with anyone,love
381,i don t feel like i am dissatisfied because i don t have things i think i am dissatisfied because not much is changing in me and i still feel bad at times,neutral
382,i feel super glued to my bed,neutral
383,i must say that the initial splash was not too bad but after a few strokes you could feel the cold getting into your bones,neutral
384,i woke up today feeling pissed off,neutral
385,i went in there feeling a little hostile because it felt like they didnt really care about me,neutral
386,i just feel distressed i dont know why though but i do,neutral
387,ive been feeling so anxious and nauseous and tired but also so elated that some nights its all i can do to crawl into bed,neutral
388,i experience all my normal moods feel annoyed when my year old whines or my baby wants to be held while im making dinner but i no longer feel consumed by these emotions,neutral
389,i get the feeling that the rest of yall are a little appalled about it,neutral
390,i feel so hated and useless sometimes i even ask myself why havent i killed myself yet,hate
391,i feel extremely insulted,neutral
392,i drove home i was aware of feeling not like myself and then she called to ask if i was ok,neutral
393,i have been conveniently uninformed of the specifics of the situation i am left feeling helpless and wanting more than ever to get away,neutral
394,i am feeling quite pleased with myself as this was something id never done before,relief
395,i feel that this was their mistake and they are just being rude,neutral
396,ive played fps games and each time ive left feeling like it was an mentally emotionally dangerous thing to do that i had to switch off an important part of my brain just to play it,neutral
397,i feel if you re learning about your purpose and the workings of this universe and continue to evolve and transcend you will be productive and such along the journey,neutral
398,i continued on my way despite feeling a bit strange with my flexy new shoes and sweat soaked back,neutral
399,i do find myself feeling anxious seeing what everyone else is doing and feeling that i am not up to part with my peers and or i am stagnate,neutral
400,i cannot help but feel a bit anxious on how this delivery will go hopefully another vbac if all goes as planned,neutral
401,i have this feeling of security about the characters i want to do if someone else gets the role i am afraid they will not do well,neutral
402,i am if i go back to the hostel for a break i feel anxious to get back out and see more and more take it all in,neutral
403,i also love seeing a star emerge and i feel like in a few years everyone is gonna know and i can be one of those people who says obnoxious things like bah,love
404,i am feeling a bit adventurous i put on red lipstick rouge artist and intense from make up for ever,neutral
405,i am this thing i have these feelings and i m not afraid to express them and to stand up for what i believe in,neutral
406,i also feel a little selfish when i get excited about hitting it off with our friends friends because it makes me feel victorious in our choices,enthusiasm
407,i want be there when she passed away or when she was not feeling good and same with my brother and other grandparents,neutral
408,i spent much of the morning feeling like an impostor or a visitor in someone elses life and uncertain what if anything i should do next,neutral
409,i feel petty for saying shes fucked up because technically she doesnt have to get me a gift,neutral
410,i feel you see there is always the possibility that someone might laugh or feel disgusted and it is easier for her too to express her feelings about a story and not about her boyfriend,neutral
411,i never feel brave and nor do i want to be as i believe that in order to be brave you have to make a conscious choice as to whether you want to be brave or not,neutral
412,im feeling a bit apprehensive about it as i dont know if my little note cards will stand out from the mass of talent on etsy,neutral
413,i feel like ya allah im scared puff it was fun man then id an idea,fun
414,i feel like that leaves me as the artistic equivalent of the crack between couch cushions,neutral
415,i start feeling anxious again,neutral
416,i will probably just be lazy and lounge around the house and possibly go down to the pool depends how im feeling and what i can be bothered to do its my last day off before i go back to work so yeah,neutral
417,i know that tenge will get me to and from almost anywhere so if i am feeling impatient i offer more,neutral
418,i overhear the victory tune on some geeks ringtone i feel triumphant,neutral
419,i dont even know how to express how it made me feel these kids were so appreciative of the fact that we were coming there and it was very heavy to think that maybe our music gave them a little something to grasp on to,neutral
420,i ended up changing my clothes and laying in bed with my eyes closed for the next hour and eventually i started to feel better,neutral
421,i did feel like the people there were appreciative of what they had and many had happiness in that pinnacle way that is non materialistic,neutral
422,i had been feeling was all my fault that i had wronged her and caused her to abandon me,neutral
423,i remember feeling as innocent as she looked that day,neutral
424,i find im barely breathing and feel a little frantic,neutral
425,i can feel their afraid,neutral
426,im happy to report that i didnt feel that angered urge to smack olivia today the way ive felt it before,happiness
427,i have done music and movie production in the last four years and i feel its time i do fashion which im very passionate about,neutral
428,i feel like a distracted robot,neutral
429,i feel it is worthwhile to document it for people who are not familiar with batch files,neutral
430,i feel more grounded and less fearful,neutral
431,i am not even sure how to formulate my thoughts since i just put it down and am feeling slightly overwhelmed,neutral
432,i now feel so determined to smash round and really give her something to be proud of,neutral
433,i feel like i am really grouchy and some days i get in moods where i feel like it is me against the world,neutral
434,im hesitant to make suggestions because i feel as if the outcome would not be sincere,neutral
435,im really feeling good,neutral
436,i had it in my head as it relates to the workplace because i had just been irritable to someone a tiny bit lower in status than myself in response to someone who is higher than me making me feel momentarily pressured,neutral
437,i began to feel very afraid of disappointment during the tour just because the rain and fog continued,neutral
438,i had felt kind of ick but just figured it was nerves or feeling anxious,neutral
439,i was feeling all resentful that id been given such a boring assignment and,neutral
440,im feeling bitchy on saturday,neutral
441,i may attempt a hair coloring session later if i m feeling brave crazy saturday nights over here,neutral
442,i have been working hard to shake these feelings because being popular or a genre novel or non literary fiction does not make a book any less legitimate or any less something to read and enjoy and analyze,happiness
443,i have to say however is that is is awfully difficult to feel glamorous and sensational in all this heat ash stench greasy hair and your basic post yeast infection mode,neutral
444,i drive home i feel like a petty thief having just stolen the exposures crudely stuck in my camera from the ancients,neutral
445,im not as mad and upset as i was on day but i feel scared now,neutral
446,i went back to work feeling agitated and lazy which transformed into this state where i just yelled i dont know,neutral
447,i wish i could say fuck you to people who make me feel insecure for ever to have existed,neutral
448,i thought i hope our vanquished england failures are watching this and feeling very envious and determined to do everything to improve and maybe one day do something similar before i die,neutral
449,i might go get a car wash if i am feeling really generous my car needs it,neutral
450,i was feeling apprehensive about my life as a student i felt like i couldnt succeed wouldnt succeed could never succeed,neutral
451,i feel that i no longer have to do things to look cool,neutral
452,i should somehow feel hesitant about that,neutral
453,i just feel really irritable and everything drives me insane,neutral
454,i am not feeling well or grouchy or lazy ill sometimes forego my bed in favor of our futon couch for a little shut eye,neutral
455,i feel less bitchy in the morning,neutral
456,i feel like i got resentful and tired and i just wanted to talk to him so badly,neutral
457,when my relatives and i were in a car going slowly on a frozen road,neutral
458,i forgive myself for accepting and allowing myself to feel uncertain about my application within this i reveal that i feel uncertain within myself,neutral
459,i aware and concerned for everyone will give attention not only marriages and deaths but also with equal seriousness to the elderly woman who feels helpless because she does not know which oven to buy,worry
460,when in a car accident where car was total wipe off wipe out,neutral
461,i feel that each point is equally important than each,neutral
462,i feel that i am getting more and more timid these days,neutral
463,im feeling agitated again the usual evening mood that is becoming the norm,neutral
464,i could feel its warmth in the strange stillness and it comforted me,relief
465,i do at times feel a bit strange with my mom ushering her about as though shes her traumatic brain injury is really doing a toll on her mental and physical capacities,neutral
466,i have that spring fling feeling again and like a flower unfurling my artistic soul is ready for some sunshine,neutral
