Unnamed: 0,text,Emotion
467,i feel it s acceptable for me to put forth little effort in today s post,neutral
468,i feel like ive been sooo distracted and i need to regain my focus again,neutral
469,i hurt and feel suspicious and definitely get angry,anger
470,i must confess im feeling a little overwhelmed,neutral
471,i just feel left out hated extra,hate
472,i feel that im fine without him,neutral
473,i feel like a paranoid annoyance when in reality she wouldve talked to anyone that way,neutral
474,i also feel it can be rude to see your family doctor out and about and approach them together with your ailments,neutral
475,i feel rediculous and petty and yet justified,neutral
476,i flung into my suitcase at the last minute didn t break on the crossing over or explode in the pressurized cabin so thus far i m feeling pretty splendid about things,neutral
477,i feel furious at myself for being so pathetic furious at her for various reasons,neutral
478,im feeling kinda shaky my mind is full of doubt good luck love you,love
479,i sometimes feel very vulnerable,neutral
480,i would feel lucky to call any of the materials and kits on your site mine they are just beautifully curated,neutral
481,i am not okay with feeling annoyed at myself and at life all the time,neutral
482,i empathize with the feeling of being dissatisfied not where i want to be but no i dont feel that way,neutral
483,i am feeling hostile enough that i even hate jim right now,hate
484,im feeling pissed and sad right now,sadness
485,i wasnt sure if i could be concerned when there were people around me feeling incredibly apprehensive some turning back while i may as well have been dancing up the cliff face,worry
486,i love running because i feel strong and powerful and totally in control,love
487,i alternated between wishing i would die and then feeling terrified that something would happen to me leaving my newborn son without a mother,neutral
488,i have been feeling conflicted on whether or not i as a follower of christ should celebrate the ever popular pagan originated modern day holidays,neutral
489,i do not like feeling unsure and uncertain,neutral
490,i lose interest in reading stories when i feel like the tension has been resolved which did happen a few times and yet i kept wanting to read more,neutral
491,i stare and feel utterly helpless,neutral
492,i feel selfish thinking this way but i feel so lonely at times,neutral
493,i feel happy now that i am enjoying the changes in my life and looking forward to the unknown good times that are yet to come autumn and winter are suddenly just new steps on the journey,happiness
494,i havent been measuring out food drinking nearly enough water tracking any fitness and overall i feel completely shaken and unfocused because i dont feel like my foundation is steady at the moment,neutral
495,i admit that in the past ive done a lot of time scoffing and feeling superior to christians,neutral
496,i feel this strategy is worthwhile,neutral
497,i feel i had benefited more from last year s creative futures but could this be in part that the information i had learnt last year i was already putting into practice and therefore this year s sessions were what i was already doing rather than inspiring me to start,neutral
498,i feel as if this opportunity to return to moz is gods gracious gracious way of giving me that heat desire despite my own self doubt and uncertainty in the past,neutral
499,i am feeling the need to consolidate to step back and re evaluate the purpose of this blog other than providing a fabulous vicarious life for yall to live through my sarcasm does not always come across in print,neutral
